<?xml version="1.0" encoding="UTF-8"?>
<ep:EnzymeRelatedDomains xmlns:ep="http://ebi.ac.uk/enzymeportal" 
    xmlns:xsi="http://www.w3.org/2001/XMLSchema-instance"
    xsi:schemaLocation="http://ebi.ac.uk/enzymeportal config.xsd ">
  <Domain>
    <id>intenz</id>
    <SearchFieldList>
      <SearchField>
        <id>name</id>
      </SearchField>
      <SearchField>
        <id>synonym</id>
      </SearchField>
      <SearchField>
        <id>systematic_name</id>
      </SearchField>
      <SearchField>
        <id>id</id>
      </SearchField>
    </SearchFieldList>
  </Domain>
  <Domain>
    <id>rhea</id>
    <SearchFieldList>
      <SearchField>
        <id>acc</id>
      </SearchField>
      <SearchField>
        <id>id</id>
      </SearchField>
      <SearchField>
        <id>chebiidequation</id>
      </SearchField>
      <SearchField>
        <id>name</id>
      </SearchField>
    </SearchFieldList>
  </Domain>
  <Domain>
    <id>reactome</id>
    <SearchFieldList>
      <SearchField>
        <id>acc</id>
      </SearchField>
      <SearchField>
        <id>id</id>
      </SearchField>
      <SearchField>
        <id>name</id>
      </SearchField>
      <SearchField>
        <id>description</id>
      </SearchField>
    </SearchFieldList>
  </Domain>
  <Domain>
    <id>chebi</id>
    <SearchFieldList>
      <SearchField>
        <id>acc</id>
      </SearchField>
      <SearchField>
        <id>id</id>
      </SearchField>
      <SearchField>
        <id>name</id>
      </SearchField>
      <SearchField>
        <id>synonym</id>
      </SearchField>
    </SearchFieldList>
  </Domain>
  <Domain>
    <id>chembl-compound</id>
    <SearchFieldList>
      <SearchField>
        <id>acc</id>
      </SearchField>
      <SearchField>
        <id>id</id>
      </SearchField>
    </SearchFieldList>
  </Domain>
  <Domain>
    <id>pdbe</id>
    <SearchFieldList>
      <SearchField>
        <id>acc</id>
      </SearchField>
      <SearchField>
        <id>id</id>
      </SearchField>
      <SearchField>
        <id>description</id>
      </SearchField>
      <SearchField>
        <id>keywords</id>
      </SearchField>
      <SearchField>
        <id>name</id>
      </SearchField>
    </SearchFieldList>
  </Domain>
<Domain>
    <id>uniprot</id>
    <SearchFieldList>
      <SearchField>
        <id>acc</id>
      </SearchField>
      <SearchField>
        <id>id</id>
      </SearchField>
      <SearchField>
        <id>descRecName</id>
      </SearchField>
      <SearchField>
        <id>description</id>
      </SearchField>
      <SearchField>
        <id>keywords</id>
      </SearchField>
      <SearchField>
        <id>organism_species</id>
      </SearchField>
      <SearchField>
        <id>organism_scientific_name</id>
      </SearchField>
      <SearchField>
        <id>organism_lineage</id>
      </SearchField>
      <SearchField>
        <id>organism_host_species</id>
      </SearchField>      
      <SearchField>
        <id>dbRefProp_EMBL_protein_sequence_ID</id>
      </SearchField>
      <SearchField>
        <id>dbRefProp_EnsemblBacteria_protein_sequence_ID</id>
      </SearchField>
      <SearchField>
        <id>dbRefProp_EnsemblFungi_protein_sequence_ID</id>
      </SearchField>
      <SearchField>
        <id>dbRefProp_EnsemblMetazoa_protein_sequence_ID</id>
      </SearchField>
      <SearchField>
        <id>dbRefProp_EnsemblPlants_protein_sequence_ID</id>
      </SearchField>
      <SearchField>
        <id>dbRefProp_EnsemblProtists_protein_sequence_ID</id>
      </SearchField>
      <SearchField>
        <id>dbRefProp_Ensembl_protein_sequence_ID</id>
      </SearchField>
      <SearchField>
        <id>dbRefProp_GeneFarm_family_ID</id>
      </SearchField>
      <SearchField>
        <id>dbRefProp_WormBase_protein_sequence_ID </id>
      </SearchField>
    </SearchFieldList>
    <!--acc, descSubName, gene_primary_name, id, organism_scientific_name, sequence_length, status-->
    <ResultFieldList>
      <ResultField>
        <id>id</id>
      </ResultField>
      <ResultField>
        <id>acc</id>
      </ResultField>
      <ResultField>
        <id>descRecName</id>
      </ResultField>
      <ResultField>
        <id>descSubName</id>
      </ResultField>
      <ResultField>
        <id>organism_scientific_name</id>
      </ResultField>
      <ResultField>
        <id>sequence_length</id>
      </ResultField>
      <ResultField>
        <id>status</id>
      </ResultField>
    </ResultFieldList>
  </Domain>
</ep:EnzymeRelatedDomains>
